{
  "approval_id": "V3-01-APP-054",
  "gate_id": "G-02",
  "decision": "APPROVED",
  "scope": "Rebind G-02-ASR v1.1 to the dated RC-13 duration, file-size, native-timestamp, VND and split-timeout envelope for at most two fresh derived whisper-1 acceptance operations.",
  "artifact_or_commit_hashes": [
    "1e0146b44b19a5afcef267132d71d36d24a952e4",
    "8675d1147f9c51ba4179fb95168c8799f0940dc0b1ea339230d585d6bd0b46d0",
    "179624fe3a365e415c41b760e49297da0cd23227cf9b49a634e7fbcaaf90b47e"
  ],
  "target_account_or_environment": "Isolated owner-gated acceptance runner; checked-in and production budgets remain zero",
  "limits": [
    "500 VND atomic reservation per operation",
    "1250 VND maximum for the whole acceptance window",
    "162 VND per minute accounting rate derived from 0.006 USD/minute at fixed 27000 VND/USD",
    "One file per operation, minimum acceptance duration 90 seconds and hard duration cap 180 seconds",
    "File size no greater than 25000000 bytes",
    "Language vi, verbose_json, native segment and word timestamps",
    "Provider HTTP timeout 90 seconds and controller hard envelope 120 seconds",
    "One attempt, concurrency 1, no automatic retry and no fallback",
    "Window 2026-09-06T14:00:00Z through 2026-09-06T18:00:00Z only",
    "No provider call until a separate owner decision authorizes RC-13 Operation 1"
  ],
  "approved_by": "Owner (GitHub: vangnguyen)",
  "approved_at_utc": "2026-09-05T15:51:00Z",
  "expires_at_utc": "2026-09-06T18:00:00Z",
  "notes": "The owner instructed a fresh RC-13 rebind while preserving the previously approved 500/1250 VND envelope. The new budget-day and execution-scope hashes are exact. This record does not enable checked-in budget or authorize an API call; any bundle, scope or window mutation requires another review and rebind."
}
