{
  "approval_id": "V3-01-APP-066",
  "gate_id": "G-02",
  "decision": "APPROVED",
  "scope": "Rebind G-02-ASR v1.1 to the dated RC-16 W1 duration, file-size, native-timestamp, VND and split-timeout envelope for at most two fresh derived whisper-1 acceptance operations.",
  "artifact_or_commit_hashes": [
    "55b22f773dc108f6c51a1b52db825b1caa8e8a51",
    "a8193d044551999cc03983f0bed860ac14011cf21c65b03453d7c2bd53c5379e",
    "9c4a7609db9f08c191af297a41d7a21b58bfe539ac5e100ea534196d17776ab1",
    "c40b2f6a055dcdae7391c997b255c72fd85960899eabb7e7559e0e8ff623c93c"
  ],
  "target_account_or_environment": "Isolated owner-gated acceptance runner; checked-in and production budgets remain zero",
  "limits": [
    "500 VND atomic reservation per operation",
    "1250 VND maximum for the whole acceptance window",
    "162 VND per minute accounting rate derived from 0.006 USD/minute at fixed 27000 VND/USD",
    "One file per operation, minimum acceptance duration 90 seconds and hard duration cap 180 seconds",
    "File size no greater than 25000000 bytes",
    "Language vi, verbose_json, native segment and word timestamps",
    "Provider HTTP timeout 90 seconds and controller hard envelope 120 seconds",
    "One attempt, concurrency 1, no automatic retry and no fallback",
    "Window 2026-09-10T14:00:00Z through 2026-09-10T18:00:00Z only",
    "No provider call until a separate owner decision authorizes RC-16 Operation 1"
  ],
  "approved_by": "Owner (GitHub: vangnguyen)",
  "approved_at_utc": "2026-09-09T02:21:26Z",
  "expires_at_utc": "2026-09-10T18:00:00Z",
  "notes": "The approved 500/1250 VND and 90/120 second envelope is unchanged; only the fresh RC-16 W1 scope, UTC budget day and operation identities are rebound. This record does not enable checked-in budget or authorize an API call. Any profile, bundle, scope or window mutation requires another review and rebind. It is not execution authority and grants no credential read, reservation or provider call."
}
