{
  "approval_id": "V3-01-APP-067",
  "gate_id": "G-03",
  "decision": "APPROVED",
  "scope": "Rebind G-03-ASR to exactly the two unchanged NPD-owned or authorized Vietnamese WAV inputs, owner-verified reference transcripts, RightsRecords and bounded W1 prompt-purpose scope for OpenAI ASR acceptance on vf-v3-01-rc16.",
  "artifact_or_commit_hashes": [
    "55b22f773dc108f6c51a1b52db825b1caa8e8a51",
    "fce31015644960a5f69640d7f5b90a7da078887b15c9d17dc227530d26b875ef",
    "dce36c5246c17e0385842006dcb0088a8c97a79d3009796815c2564c075cf20b",
    "585b460291f11f1eb54c2b9a728bca26953ccce98719859e16ab15c7af9ff36e",
    "0bff8c2b403cee452fac00f71b84759988ea515027fda6bd49be76ae382c1fef",
    "5fb56c9817595693abea89176362e0efebbcab54867788d427e9f4a76d0a8091",
    "972dcc752b6bc606a655f272472128a8e6c47fa7858f2bd0cc8e9b9f8c4e4323",
    "0d7aef962dcb5e34ed5786fadd2e9cfd156cbfb8784d498092262d33b76de7c0",
    "6985c297816ea6dc9be2d46b538495704f524ab7ed751f95f9575841c5bd6b48",
    "9c4a7609db9f08c191af297a41d7a21b58bfe539ac5e100ea534196d17776ab1",
    "c40b2f6a055dcdae7391c997b255c72fd85960899eabb7e7559e0e8ff623c93c"
  ],
  "target_account_or_environment": "Isolated owner-gated OpenAI ASR acceptance runner only",
  "limits": [
    "Exact WAV SHA-256 fce31015644960a5f69640d7f5b90a7da078887b15c9d17dc227530d26b875ef for slot 1",
    "Exact WAV SHA-256 dce36c5246c17e0385842006dcb0088a8c97a79d3009796815c2564c075cf20b for slot 2",
    "Owner-verified transcript and critical-term manifest for each unchanged WAV",
    "Exact same W1 vocabulary profile on both assets; asset 02 remains the negative-insertion guard",
    "OpenAI ASR acceptance processing only",
    "Speaker voice-processing consent applies only to this bounded acceptance",
    "No publishing, training, resale or other use",
    "No provider call until a separate owner decision authorizes RC-16 Operation 1"
  ],
  "approved_by": "Owner (GitHub: vangnguyen)",
  "approved_at_utc": "2026-09-09T02:21:26Z",
  "expires_at_utc": "2026-09-10T18:00:00Z",
  "notes": "The owner permitted the same two WAVs, owner-verified transcripts and RightsRecords to be rebound after exact hash, permission and expiry validation. This record adds no media right: W1 is bounded input context only. Publishing, training and resale remain prohibited. This record is not execution authority and grants no credential read or provider call. RC-15 operation IDs, bundle, window and authority are retired and cannot be reused."
}
